{
  "schema_version": "melissa.skill-definition/v1",
  "id": "melissa.code.skill.evidence-review",
  "module": "code",
  "name_tr": "Kanıta dayalı review ve kod güvenliği",
  "description_tr": "Eyleme dönük gerçek kusuru doğru kaynak ve karşı örnekle göster; tarayıcı etiketini kesin bulgu yapma.",
  "use_when": [
    "code_review",
    "security_review"
  ],
  "manifest": {
    "entrypoint": "SKILL.md",
    "category": "coding",
    "trust_level": "first_party",
    "routing": {
      "intents": [
        "code_review",
        "security_review"
      ],
      "priority": 80
    },
    "required_tools": [
      "fs.read",
      "code.references",
      "code.tests"
    ],
    "required_capabilities": [
      "workspace.read"
    ],
    "prerequisites": [
      "host-reviewed captured package and exact task policy"
    ],
    "runtime": {
      "timeout_seconds": 1800,
      "max_iterations": 64,
      "max_parallel_tools": 2,
      "max_cost_micro_usd": 1250000
    },
    "input_schema_ref": "schemas/input.json",
    "output_schema_ref": "schemas/output.json",
    "verification": [
      {
        "check": "source_bound_real_tool_evidence",
        "required": true
      },
      {
        "check": "negative_case_and_scope_preservation",
        "required": true
      }
    ],
    "evaluation": {
      "dataset_ref": "evals/cases.jsonl",
      "assertions_ref": "evals/assertions.json",
      "min_success_rate": 1.0
    }
  },
  "files": [
    {
      "path": "SKILL.md",
      "content_digest": "blake3:e3b16dca0b1081c232c3dc37cf52784d3da40463fab45abde2598a2335819ef8",
      "role": "entrypoint"
    },
    {
      "path": "assets/report.md",
      "content_digest": "blake3:434f08a44509eefcc818e8ffa20949e9a344e1c8c07e640d249ff64199dbec62",
      "role": "template"
    },
    {
      "path": "evals/assertions.json",
      "content_digest": "blake3:fbb8229e454a30fb69702cf8fe35227645c7137f88b374b104ae1e4d19a44786",
      "role": "evaluation"
    },
    {
      "path": "evals/cases.jsonl",
      "content_digest": "blake3:e250ae9d5a553fafd5166398a9a13f321b3ecfb9f780626c2c6422fd4ab5e1d7",
      "role": "evaluation"
    },
    {
      "path": "references/acceptance.md",
      "content_digest": "blake3:8120ade5a5411824828760e27f12669f6435b4a797dd8df80dc00f3007c63e41",
      "role": "reference"
    },
    {
      "path": "schemas/input.json",
      "content_digest": "blake3:71e6e8c04194f75467194fd40ed49dec582d366aa90fe5a0d0ded87571c64e13",
      "role": "schema"
    },
    {
      "path": "schemas/output.json",
      "content_digest": "blake3:a839a305ab153d5e549af04db0cde7691722bf780b16c92c7a98fabf76111969",
      "role": "schema"
    },
    {
      "path": "schemas/report-input.json",
      "content_digest": "blake3:057757f75287575178678502c2c5e5b7a09576c66dc45db4c4549721ae85024a",
      "role": "schema"
    },
    {
      "path": "schemas/report-output.json",
      "content_digest": "blake3:138a8766305285af49d60d11ce265b4a9977d6c4f8be210a5224ac7dc8428a08",
      "role": "schema"
    },
    {
      "path": "scripts/assess.py",
      "content_digest": "blake3:46db0b456aed1459046870cc13cbb0138b075b97542c745aee2a55ec54fe5ea2",
      "role": "script"
    },
    {
      "path": "tests/README.md",
      "content_digest": "blake3:a173a375de7832634250ba4ee11d2be8505ad3ce5d1ebdf868c49822adf9c6f2",
      "role": "test"
    }
  ],
  "scripts": [
    {
      "file_path": "scripts/assess.py",
      "interpreter_ref": "code06-pinned-python/3.13.5",
      "input_schema_ref": "schemas/input.json",
      "output_schema_ref": "schemas/output.json",
      "required_capabilities": [],
      "timeout_seconds": 30
    }
  ],
  "templates": [
    {
      "file_path": "assets/report.md",
      "input_schema_ref": "schemas/report-input.json",
      "output_schema_ref": "schemas/report-output.json"
    }
  ]
}