{
  "schema_version": "melissa.skill-definition/v1",
  "id": "melissa.code.skill.implementation-refactor",
  "module": "code",
  "name_tr": "Özellik geliştirme ve refactor",
  "description_tr": "En küçük doğru değişikliği gerçek tüketicilerde uygula ve kullanıcı çalışmasını koru.",
  "use_when": [
    "implement_feature",
    "refactor"
  ],
  "manifest": {
    "entrypoint": "SKILL.md",
    "category": "coding",
    "trust_level": "first_party",
    "routing": {
      "intents": [
        "implement_feature",
        "refactor"
      ],
      "priority": 80
    },
    "required_tools": [
      "fs.read",
      "fs.patch",
      "code.build",
      "code.tests"
    ],
    "required_capabilities": [
      "workspace.read",
      "workspace.apply_patch_scoped"
    ],
    "prerequisites": [
      "host-reviewed captured package and exact task policy"
    ],
    "runtime": {
      "timeout_seconds": 1800,
      "max_iterations": 64,
      "max_parallel_tools": 2,
      "max_cost_micro_usd": 1250000
    },
    "input_schema_ref": "schemas/input.json",
    "output_schema_ref": "schemas/output.json",
    "verification": [
      {
        "check": "source_bound_real_tool_evidence",
        "required": true
      },
      {
        "check": "negative_case_and_scope_preservation",
        "required": true
      }
    ],
    "evaluation": {
      "dataset_ref": "evals/cases.jsonl",
      "assertions_ref": "evals/assertions.json",
      "min_success_rate": 1.0
    }
  },
  "files": [
    {
      "path": "SKILL.md",
      "content_digest": "blake3:a32e6b5da5021826f770d359c25ceffb0cb55b2ddce644e297eafb098d67fec1",
      "role": "entrypoint"
    },
    {
      "path": "assets/report.md",
      "content_digest": "blake3:434f08a44509eefcc818e8ffa20949e9a344e1c8c07e640d249ff64199dbec62",
      "role": "template"
    },
    {
      "path": "evals/assertions.json",
      "content_digest": "blake3:fbb8229e454a30fb69702cf8fe35227645c7137f88b374b104ae1e4d19a44786",
      "role": "evaluation"
    },
    {
      "path": "evals/cases.jsonl",
      "content_digest": "blake3:68197c5d212cf47396fe5c12adbe658b92cda955b46e32d3dd5b00237a27d8aa",
      "role": "evaluation"
    },
    {
      "path": "references/acceptance.md",
      "content_digest": "blake3:b1430c48dc24a25f09e05bf98d5123729f6fbda62c3d2a95072ed481932a40e7",
      "role": "reference"
    },
    {
      "path": "schemas/input.json",
      "content_digest": "blake3:a38e225a16096e8c6828670e351576015e5ee2b087f71f3ae2855e32c9f6498c",
      "role": "schema"
    },
    {
      "path": "schemas/output.json",
      "content_digest": "blake3:a839a305ab153d5e549af04db0cde7691722bf780b16c92c7a98fabf76111969",
      "role": "schema"
    },
    {
      "path": "schemas/report-input.json",
      "content_digest": "blake3:057757f75287575178678502c2c5e5b7a09576c66dc45db4c4549721ae85024a",
      "role": "schema"
    },
    {
      "path": "schemas/report-output.json",
      "content_digest": "blake3:138a8766305285af49d60d11ce265b4a9977d6c4f8be210a5224ac7dc8428a08",
      "role": "schema"
    },
    {
      "path": "scripts/assess.py",
      "content_digest": "blake3:c21f7ca695af75af0b5088928ca9ba1fddb9829065b95fe963211e20f8a1185c",
      "role": "script"
    },
    {
      "path": "tests/README.md",
      "content_digest": "blake3:a173a375de7832634250ba4ee11d2be8505ad3ce5d1ebdf868c49822adf9c6f2",
      "role": "test"
    }
  ],
  "scripts": [
    {
      "file_path": "scripts/assess.py",
      "interpreter_ref": "code06-pinned-python/3.13.5",
      "input_schema_ref": "schemas/input.json",
      "output_schema_ref": "schemas/output.json",
      "required_capabilities": [],
      "timeout_seconds": 30
    }
  ],
  "templates": [
    {
      "file_path": "assets/report.md",
      "input_schema_ref": "schemas/report-input.json",
      "output_schema_ref": "schemas/report-output.json"
    }
  ]
}