{
  "schema_version": "melissa.skill-definition/v1",
  "id": "melissa.code.skill.build-release",
  "module": "code",
  "name_tr": "Build, dependency ve release",
  "description_tr": "Tekrarlanabilir toolchain/lock/input zincirinden gerçek çalışan artifact üretimini kanıtla.",
  "use_when": [
    "build_environment",
    "dependency_upgrade",
    "release_artifact"
  ],
  "manifest": {
    "entrypoint": "SKILL.md",
    "category": "coding",
    "trust_level": "first_party",
    "routing": {
      "intents": [
        "build_environment",
        "dependency_upgrade",
        "release_artifact"
      ],
      "priority": 80
    },
    "required_tools": [
      "fs.read",
      "code.build",
      "code.tests"
    ],
    "required_capabilities": [
      "workspace.read"
    ],
    "prerequisites": [
      "host-reviewed captured package and exact task policy"
    ],
    "runtime": {
      "timeout_seconds": 1800,
      "max_iterations": 64,
      "max_parallel_tools": 2,
      "max_cost_micro_usd": 1250000
    },
    "input_schema_ref": "schemas/input.json",
    "output_schema_ref": "schemas/output.json",
    "verification": [
      {
        "check": "source_bound_real_tool_evidence",
        "required": true
      },
      {
        "check": "negative_case_and_scope_preservation",
        "required": true
      }
    ],
    "evaluation": {
      "dataset_ref": "evals/cases.jsonl",
      "assertions_ref": "evals/assertions.json",
      "min_success_rate": 1.0
    }
  },
  "files": [
    {
      "path": "SKILL.md",
      "content_digest": "blake3:a7c7f0f765e8fd3cf9884647e125f57511746ce556263df680e02b54c6351d2d",
      "role": "entrypoint"
    },
    {
      "path": "assets/report.md",
      "content_digest": "blake3:434f08a44509eefcc818e8ffa20949e9a344e1c8c07e640d249ff64199dbec62",
      "role": "template"
    },
    {
      "path": "evals/assertions.json",
      "content_digest": "blake3:fbb8229e454a30fb69702cf8fe35227645c7137f88b374b104ae1e4d19a44786",
      "role": "evaluation"
    },
    {
      "path": "evals/cases.jsonl",
      "content_digest": "blake3:726783302bd26c21289d361898f34ee9cbb1a64f4616114c1e77ad1a04f2a4e5",
      "role": "evaluation"
    },
    {
      "path": "references/acceptance.md",
      "content_digest": "blake3:1bf1a6bd9c8ca171a6e8550ef7db3cf305143e2161b9de1462264077572b4a24",
      "role": "reference"
    },
    {
      "path": "schemas/input.json",
      "content_digest": "blake3:d4323b27a2801a0ceb4b1d97d6650e9c9868e7276368cdde4c10e18724e29ee8",
      "role": "schema"
    },
    {
      "path": "schemas/output.json",
      "content_digest": "blake3:a839a305ab153d5e549af04db0cde7691722bf780b16c92c7a98fabf76111969",
      "role": "schema"
    },
    {
      "path": "schemas/report-input.json",
      "content_digest": "blake3:057757f75287575178678502c2c5e5b7a09576c66dc45db4c4549721ae85024a",
      "role": "schema"
    },
    {
      "path": "schemas/report-output.json",
      "content_digest": "blake3:138a8766305285af49d60d11ce265b4a9977d6c4f8be210a5224ac7dc8428a08",
      "role": "schema"
    },
    {
      "path": "scripts/assess.py",
      "content_digest": "blake3:74c42f89209fef0257a75a00ab40dbab128f19b609a1b311bba3f0142f8c6eb2",
      "role": "script"
    },
    {
      "path": "tests/README.md",
      "content_digest": "blake3:a173a375de7832634250ba4ee11d2be8505ad3ce5d1ebdf868c49822adf9c6f2",
      "role": "test"
    }
  ],
  "scripts": [
    {
      "file_path": "scripts/assess.py",
      "interpreter_ref": "code06-pinned-python/3.13.5",
      "input_schema_ref": "schemas/input.json",
      "output_schema_ref": "schemas/output.json",
      "required_capabilities": [],
      "timeout_seconds": 30
    }
  ],
  "templates": [
    {
      "file_path": "assets/report.md",
      "input_schema_ref": "schemas/report-input.json",
      "output_schema_ref": "schemas/report-output.json"
    }
  ]
}