{
  "schema_version": "melissa.skill-definition/v1",
  "id": "melissa.code.skill.backend-effects",
  "module": "code",
  "name_tr": "Backend API ve gerçek etkiler",
  "description_tr": "API yanıtı ile gerçek veri/etki durumunun tutarlı olduğunu sınayacak sözleşme kur.",
  "use_when": [
    "backend_api",
    "idempotency"
  ],
  "manifest": {
    "entrypoint": "SKILL.md",
    "category": "coding",
    "trust_level": "first_party",
    "routing": {
      "intents": [
        "backend_api",
        "idempotency"
      ],
      "priority": 80
    },
    "required_tools": [
      "fs.read",
      "code.tests"
    ],
    "required_capabilities": [
      "workspace.read"
    ],
    "prerequisites": [
      "host-reviewed captured package and exact task policy"
    ],
    "runtime": {
      "timeout_seconds": 1800,
      "max_iterations": 64,
      "max_parallel_tools": 2,
      "max_cost_micro_usd": 1250000
    },
    "input_schema_ref": "schemas/input.json",
    "output_schema_ref": "schemas/output.json",
    "verification": [
      {
        "check": "source_bound_real_tool_evidence",
        "required": true
      },
      {
        "check": "negative_case_and_scope_preservation",
        "required": true
      }
    ],
    "evaluation": {
      "dataset_ref": "evals/cases.jsonl",
      "assertions_ref": "evals/assertions.json",
      "min_success_rate": 1.0
    }
  },
  "files": [
    {
      "path": "SKILL.md",
      "content_digest": "blake3:25e6a5ddec06875f27d5ad9be021cbe26be940808ca9941936b4ffe93730864e",
      "role": "entrypoint"
    },
    {
      "path": "assets/report.md",
      "content_digest": "blake3:434f08a44509eefcc818e8ffa20949e9a344e1c8c07e640d249ff64199dbec62",
      "role": "template"
    },
    {
      "path": "evals/assertions.json",
      "content_digest": "blake3:fbb8229e454a30fb69702cf8fe35227645c7137f88b374b104ae1e4d19a44786",
      "role": "evaluation"
    },
    {
      "path": "evals/cases.jsonl",
      "content_digest": "blake3:4f17095aefeeebcbdff37488eb5295b75f95d0263468524b8141fb0161819a56",
      "role": "evaluation"
    },
    {
      "path": "references/acceptance.md",
      "content_digest": "blake3:a8e4fba985260b1e519a39efa19816b36fe5bd643ba39c52ac6abf5891bc4399",
      "role": "reference"
    },
    {
      "path": "schemas/input.json",
      "content_digest": "blake3:50cb4c27d1d92f763f7419af63ea607ce6a4c934dad89c5b7b7563bd448e77fb",
      "role": "schema"
    },
    {
      "path": "schemas/output.json",
      "content_digest": "blake3:a839a305ab153d5e549af04db0cde7691722bf780b16c92c7a98fabf76111969",
      "role": "schema"
    },
    {
      "path": "schemas/report-input.json",
      "content_digest": "blake3:057757f75287575178678502c2c5e5b7a09576c66dc45db4c4549721ae85024a",
      "role": "schema"
    },
    {
      "path": "schemas/report-output.json",
      "content_digest": "blake3:138a8766305285af49d60d11ce265b4a9977d6c4f8be210a5224ac7dc8428a08",
      "role": "schema"
    },
    {
      "path": "scripts/assess.py",
      "content_digest": "blake3:db4601d5b81eadc1c0ce698d9e65649188a9446422d62a7dd50dc9f950cf8ce5",
      "role": "script"
    },
    {
      "path": "tests/README.md",
      "content_digest": "blake3:a173a375de7832634250ba4ee11d2be8505ad3ce5d1ebdf868c49822adf9c6f2",
      "role": "test"
    }
  ],
  "scripts": [
    {
      "file_path": "scripts/assess.py",
      "interpreter_ref": "code06-pinned-python/3.13.5",
      "input_schema_ref": "schemas/input.json",
      "output_schema_ref": "schemas/output.json",
      "required_capabilities": [],
      "timeout_seconds": 30
    }
  ],
  "templates": [
    {
      "file_path": "assets/report.md",
      "input_schema_ref": "schemas/report-input.json",
      "output_schema_ref": "schemas/report-output.json"
    }
  ]
}